Plugin ID,Plugin Name,Severity,Description,Solution
108797,Unsupported Windows OS (remote),Critical,"The remote version of Microsoft Windows is either missing a service pack or is no longer supported. As a result, it is likely to contain security vulnerabilities.",Upgrade to a supported service pack or operating system.
97833,MS17-010: Security Update for Microsoft Windows SMB Server (4013389) (ETERNALBLUE) (ETERNALCHAMPION) (ETERNALROMANCE) (ETERNALSYNERGY) (WannaCry) (EternalRocks) (Petya) (uncredentialed check),High,"The remote Windows host is affected by the following vulnerabilities :

- Multiple remote code execution vulnerabilities exist in Microsoft Server Message Block 1.0 (SMBv1) due to improper handling of certain requests. An unauthenticated, remote attacker can exploit these vulnerabilities, via a specially crafted packet, to execute arbitrary code. (CVE-2017-0143, CVE-2017-0144, CVE-2017-0145, CVE-2017-0146, CVE-2017-0148)

- An information disclosure vulnerability exists in Microsoft Server Message Block 1.0 (SMBv1) due to improper handling of certain requests. An unauthenticated, remote attacker can exploit this, via a specially crafted packet, to disclose sensitive information. (CVE-2017-0147)

ETERNALBLUE, ETERNALCHAMPION, ETERNALROMANCE, and ETERNALSYNERGY are four of multiple Equation Group vulnerabilities and exploits disclosed on 2017/04/14 by a group known as the Shadow Brokers. WannaCry / WannaCrypt is a ransomware program utilizing the ETERNALBLUE exploit, and EternalRocks is a worm that utilizes seven Equation Group vulnerabilities. Petya is a ransomware program that first utilizes CVE-2017-0199, a vulnerability in Microsoft Office, and then spreads via ETERNALBLUE.","Microsoft has released a set of patches for Windows Vista, 2008, 7, 2008 R2, 2012, 8.1, RT 8.1, 2012 R2, 10, and 2016. Microsoft has also released emergency patches for Windows operating systems that are no longer supported, including Windows XP, 2003, and 8.

For unsupported Windows operating systems, e.g. Windows XP, Microsoft recommends that users discontinue the use of SMBv1. SMBv1 lacks security features that were included in later SMB versions. SMBv1 can be disabled by following the vendor instructions provided in Microsoft KB2696547. Additionally, US-CERT recommends that users block SMB directly by blocking TCP port 445 on all network boundary devices. For SMB over the NetBIOS API, block TCP ports 137 / 139 and UDP ports 137 / 138 on all network boundary devices."
90510,MS16-047: Security Update for SAM and LSAD Remote Protocols (3148527) (Badlock) (uncredentialed check),Medium,"The remote Windows host is affected by an elevation of privilege vulnerability in the Security Account Manager (SAM) and Local Security Authority (Domain Policy) (LSAD) protocols due to improper authentication level negotiation over Remote Procedure Call (RPC) channels. A man-in-the-middle attacker able to intercept communications between a client and a server hosting a SAM database can exploit this to force the authentication level to downgrade, allowing the attacker to impersonate an authenticated user and access the SAM database.","Microsoft has released a set of patches for Windows Vista, 2008, 7, 2008 R2, 2012, 8.1, RT 8.1, 2012 R2, and 10."
57608,SMB Signing Not Required,Medium,"The remote SMB server does not require message signing. An unauthenticated, remote attacker can exploit this to conduct man-in-the-middle attacks against the SMB server.","Enforce message signing in the host's configuration. On Windows, this is found in the policy setting 'Microsoft network server: Digitally sign communications (always)'. On Samba, the setting is 'server signing = mandatory' in the smb.conf file."
96982,Server Message Block (SMB) Protocol Version 1 Enabled (uncredentialed check),Info,The remote host supports the Server Message Block version 1 (SMBv1) protocol.,Disable SMBv1 according to vendor guidelines. Microsoft recommends disabling SMBv1 as it is legacy and lacks modern security protections.
10114,ICMP Timestamp Request Remote Date Disclosure,Info,The remote host answers to ICMP timestamp requests. This allows an attacker to know the date of the system.,Filter out ICMP timestamp requests (type 13) and responses (type 14).
10736,DCE Services Enumeration,Info,"By sending a request to the DCE/RPC endpoint mapper, it is possible to obtain a list of the DCE/RPC services listening on the remote host.",Filter incoming traffic to port 135.
11219,Nessus SYN scanner,Info,This plugin is a SYN port scanner. It determines if remote ports are open by sending TCP SYN packets.,n/a
11011,Microsoft Windows SMB Service Detection,Info,It is possible to obtain information about the remote SMB server.,n/a
10785,Microsoft Windows SMB NativeLanManager Remote System Information Disclosure,Info,It is possible to obtain information about the remote operating system from the SMB server.,n/a
100871,Microsoft Windows SMB Versions Supported (remote check),Info,The remote host supports specific SMB protocol versions.,n/a
106716,MS17-010: Security Update for Microsoft Windows SMB Server (WannaCry / EternalBlue) (credentialed check),Critical,"The remote Windows host is missing security update MS17-010. It is affected by multiple remote code execution and information disclosure vulnerabilities in Microsoft Server Message Block 1.0 (SMBv1). An unauthenticated, remote attacker can exploit these vulnerabilities, via a specially crafted packet, to execute arbitrary code or obtain sensitive information.",Microsoft has released security updates to address these vulnerabilities (MS17-010).
10150,Windows NetBIOS / SMB Remote Host Information Disclosure,Info,"It is possible to obtain information about the remote host via NetBIOS or SMB, such as the machine's NetBIOS domain name, computer name, domain SID, and OS details.",n/a
45590,Common Platform Enumeration (CPE),Info,This plugin uses operational system details to identify Common Platform Enumeration (CPE) strings.,n/a
54615,Device Type,Info,"Based on the collected information, Nessus attempts to guess the device type.",n/a
86420,ICMP Network Mask Request Information Disclosure,Info,The remote host answers to ICMP netmask requests.,Filter out ICMP netmask requests (type 17) and responses (type 18).
56877,SSL / TLS Versions Supported,Info,This plugin detects which SSL/TLS versions are supported by the remote service.,n/a
19506,Nessus Scan Information,Info,"This plugin displays information about the scan itself, such as start time, end time, scanner IP, target IP, and scan policy settings.",n/a
209654,OS Fingerprints Detected,Info,Nessus was able to detect the operating system of the target host using various fingerprinting techniques.,n/a
11936,OS Identification,Info,It was possible to identify the remote operating system using TCP/IP fingerprinting or service responses.,n/a
117886,OS Security Patch Assessment Not Available,Info,Local security checks could not be performed because access credentials were not supplied or were invalid.,Provide valid target credentials during scan configuration to enable local patch assessments.
110723,Target Credential Status by Authentication Protocol - No Credentials Provided,Info,No credentials were provided for the target host.,Provide target credentials during scan configuration.
25220,TCP/IP Timestamps Supported,Info,The remote host implements tcp timestamps per RFC 1323. Computing the uptime from timestamps can reveal system reboot intervals.,Disable TCP timestamps in operating system network configuration if required by organizational security policy.
10287,Traceroute Information,Info,Traceroute information was collected by sending packets to the target host to determine network topology and hop counts.,n/a
